{
  "schema_version": 2,
  "package_id": "predictor:package.native-portable-v2",
  "template": {
    "graph": {
      "id": "dsl-branch-merge-executable",
      "interface": {
        "inputs": [
          {
            "name": "x",
            "kind": "data",
            "representation": "tabular_numeric",
            "cardinality": "one",
            "description": ""
          }
        ],
        "outputs": [
          {
            "name": "prediction",
            "kind": "prediction",
            "representation": null,
            "cardinality": "one",
            "description": ""
          }
        ]
      },
      "nodes": [
        {
          "id": "branch:b0.model:ridge",
          "kind": "model",
          "operator": {
            "type": "Ridge"
          },
          "params": {
            "alpha": 0.3
          },
          "ports": {
            "inputs": [
              {
                "name": "x",
                "kind": "data",
                "representation": "tabular_numeric",
                "cardinality": "one",
                "description": ""
              }
            ],
            "outputs": [
              {
                "name": "oof",
                "kind": "prediction",
                "representation": null,
                "cardinality": "one",
                "description": ""
              }
            ]
          },
          "metadata": {
            "dsl_branch": "b0",
            "dsl_branch_mode": "duplication"
          },
          "seed_label": "branch:b0"
        },
        {
          "id": "branch:b1.augment:noise",
          "kind": "augmentation",
          "operator": {
            "type": "GaussianNoise"
          },
          "params": {
            "scope": "train_only",
            "std": 0.01
          },
          "ports": {
            "inputs": [
              {
                "name": "x",
                "kind": "data",
                "representation": "tabular_numeric",
                "cardinality": "one",
                "description": ""
              }
            ],
            "outputs": [
              {
                "name": "x_out",
                "kind": "data",
                "representation": "tabular_numeric",
                "cardinality": "one",
                "description": ""
              }
            ]
          },
          "metadata": {
            "dsl_branch": "b1",
            "dsl_branch_mode": "duplication"
          },
          "seed_label": "branch:b1.augment"
        },
        {
          "id": "branch:b1.model:rf",
          "kind": "model",
          "operator": {
            "type": "RandomForestRegressor"
          },
          "params": {
            "n_estimators": 64
          },
          "ports": {
            "inputs": [
              {
                "name": "x",
                "kind": "data",
                "representation": "tabular_numeric",
                "cardinality": "one",
                "description": ""
              }
            ],
            "outputs": [
              {
                "name": "oof",
                "kind": "prediction",
                "representation": null,
                "cardinality": "one",
                "description": ""
              }
            ]
          },
          "metadata": {
            "dsl_branch": "b1",
            "dsl_branch_mode": "duplication"
          },
          "seed_label": "branch:b1"
        },
        {
          "id": "merge:stack.pred_plus_original.meta:ridge",
          "kind": "model",
          "operator": {
            "type": "RidgeMetaStacker"
          },
          "params": {
            "alpha": 0.2
          },
          "ports": {
            "inputs": [
              {
                "name": "b0_oof",
                "kind": "prediction",
                "representation": null,
                "cardinality": "one",
                "description": ""
              },
              {
                "name": "b1_oof",
                "kind": "prediction",
                "representation": null,
                "cardinality": "one",
                "description": ""
              },
              {
                "name": "x_original",
                "kind": "data",
                "representation": "tabular_numeric",
                "cardinality": "one",
                "description": ""
              }
            ],
            "outputs": [
              {
                "name": "oof",
                "kind": "prediction",
                "representation": null,
                "cardinality": "one",
                "description": ""
              }
            ]
          },
          "metadata": {
            "merge_mode": "predictions_plus_original"
          },
          "seed_label": "merge:stack"
        }
      ],
      "edges": [
        {
          "source": {
            "node_id": "branch:b1.augment:noise",
            "port_name": "x_out"
          },
          "target": {
            "node_id": "branch:b1.model:rf",
            "port_name": "x"
          },
          "contract": {
            "kind": "data",
            "representation": "tabular_numeric",
            "requires_oof": false,
            "requires_fold_alignment": true,
            "propagates_lineage": true
          }
        },
        {
          "source": {
            "node_id": "branch:b0.model:ridge",
            "port_name": "oof"
          },
          "target": {
            "node_id": "merge:stack.pred_plus_original.meta:ridge",
            "port_name": "b0_oof"
          },
          "contract": {
            "kind": "prediction",
            "representation": null,
            "requires_oof": true,
            "requires_fold_alignment": true,
            "propagates_lineage": true
          }
        },
        {
          "source": {
            "node_id": "branch:b1.model:rf",
            "port_name": "oof"
          },
          "target": {
            "node_id": "merge:stack.pred_plus_original.meta:ridge",
            "port_name": "b1_oof"
          },
          "contract": {
            "kind": "prediction",
            "representation": null,
            "requires_oof": true,
            "requires_fold_alignment": true,
            "propagates_lineage": true
          }
        }
      ],
      "search_space_fingerprint": "77b9ec07501659b5f620e8815278b621dc8bd1bf5daa59c194d4cd1eb2bcdd2c",
      "metadata": {
        "demo": "executable branch/merge DSL with coordinated variants and heterogeneous merge"
      }
    },
    "campaign": {
      "id": "campaign:dsl.branch.merge.executable",
      "root_seed": 12345,
      "leakage_policy": {
        "split_unit": "sample",
        "forbid_origin_cross_fold": true,
        "allow_observation_split_with_shared_target": false,
        "require_group_ids": false,
        "unsafe_flags": []
      },
      "aggregation_policy": {
        "aggregation_level": "sample",
        "method": "mean",
        "weights": "none",
        "emit_parallel_metrics": true,
        "selection_metric_level": "sample",
        "store_raw_predictions": true,
        "store_aggregated_predictions": true
      },
      "split_invocation": {
        "id": "split:outer",
        "controller_id": null,
        "leakage_policy": {
          "split_unit": "sample",
          "forbid_origin_cross_fold": true,
          "allow_observation_split_with_shared_target": false,
          "require_group_ids": false,
          "unsafe_flags": []
        },
        "params": {
          "kind": "kfold",
          "n_splits": 2,
          "shuffle": false
        },
        "fold_set": {
          "id": "outer",
          "sample_ids": [
            "sample:1",
            "sample:2",
            "sample:3",
            "sample:4"
          ],
          "folds": [
            {
              "fold_id": "fold:0",
              "train_sample_ids": [
                "sample:3",
                "sample:4"
              ],
              "validation_sample_ids": [
                "sample:1",
                "sample:2"
              ],
              "metadata": {}
            },
            {
              "fold_id": "fold:1",
              "train_sample_ids": [
                "sample:1",
                "sample:2"
              ],
              "validation_sample_ids": [
                "sample:3",
                "sample:4"
              ],
              "metadata": {}
            }
          ],
          "sample_groups": {}
        }
      },
      "generation": {
        "strategy": "cartesian",
        "dimensions": [
          {
            "name": "stack_profile",
            "choices": [
              {
                "label": "linear_stack",
                "value": {
                  "branch:b0.model:ridge": {
                    "alpha": 0.1
                  },
                  "branch:b1.model:rf": {
                    "max_depth": 4,
                    "n_estimators": 64
                  },
                  "merge:stack.pred_plus_original.meta:ridge": {
                    "alpha": 0.05
                  }
                },
                "param_overrides": [
                  {
                    "node_id": "branch:b0.model:ridge",
                    "params": {
                      "alpha": 0.1
                    }
                  },
                  {
                    "node_id": "branch:b1.model:rf",
                    "params": {
                      "max_depth": 4,
                      "n_estimators": 64
                    }
                  },
                  {
                    "node_id": "merge:stack.pred_plus_original.meta:ridge",
                    "params": {
                      "alpha": 0.05
                    }
                  }
                ]
              },
              {
                "label": "robust_stack",
                "value": {
                  "branch:b0.model:ridge": {
                    "alpha": 1.0
                  },